<?xml version="1.0"?>
<!--
============================================
Copyright 2022 Omega International Junior School. All Right Reserved.
Web Application is under GNU General Public License v3.0
============================================
-->

<xs:schema version="1.0"
           xmlns:xs="http://www.w3.org/2001/XMLSchema"
           elementFormDefault="qualified">
    <xs:element name="announcement">
        <xs:complexType>
            <xs:sequence>
                <xs:element name="category" type="categoryType" maxOccurs="unbounded" />
            </xs:sequence>
        </xs:complexType>
    </xs:element>
    <xs:complexType name="categoryType">
        <xs:sequence>
            <xs:element name="name" type="xs:string" />
            <xs:element name="shortForm" type="xs:string" />
            <xs:element name="description" type="xs:string" />           
        </xs:sequence>
        <xs:attribute name="catID" type="xs:string" use="required" />
    </xs:complexType>
    
</xs:schema>
